date,rating,description,hotel_name,city,country,language
2022-12-31,10,One of the best hotel I ever stayed in Cancun. Highly highly recommend it if you look for a great view and amazing food,Grand Fiesta Americana,Cancun,Mexico,en
2022-12-31,10,Great location and beach,InterContinental Presidente,Cancun,Mexico,en
2022-12-30,10,Breakfast buffet quality needs ti be improved but other things were perfect,Grand Fiesta Americana,Cancun,Mexico,en
2022-12-28,10,The service was excellent.  Showers did not have great water pressure.,Grand Fiesta Americana,Cancun,Mexico,en
2022-12-28,8,Information Desk off of the main Lobby desk 2 awesome ladies that could get it done for us. Nataliley and Salma! Property very nice a good selection or Restaurants. Make sure You get the Happy Hour and Breakfast package next to main desk lobby.,InterContinental Presidente,Cancun,Mexico,en
2022-12-26,8,Amazing beach!,InterContinental Presidente,Cancun,Mexico,en
2022-12-26,10,The best hotel . It’s beautiful; super clean ; the staff is amazing. Carlos from the front desk upgraded our room 10 stars 👌,InterContinental Presidente,Cancun,Mexico,en
2022-12-25,10,Personal friendly service and helpful,Warwick Geneva,Geneva,Switzerland,en
2022-12-25,10,Excellent location; great food choices; very well maintained property and staff is super helpful,Grand Fiesta Americana,Cancun,Mexico,en
2022-12-24,6,The room is very small ; room 101 is very small,Warwick Geneva,Geneva,Switzerland,en
2022-12-24,2,Nice location; old facilities; low quality food; very rude service; hidden rules on dinner reservations.,Grand Fiesta Americana,Cancun,Mexico,en
2022-12-24,10,Seasoned traveler here; traveled many places on many different levels and this property is well maintained with a spectacularly laid out beach and pool area.  We opted for the club lever and the breakfast was excellent. I'd recommend for families and travelers on all levels.,InterContinental Presidente,Cancun,Mexico,en
2022-12-22,6,The resort seems a bit old. Our room could be very noisy depending on hall traffic.  Finally; our air conditioning was crazy....on/off on/off constantly.,InterContinental Presidente,Cancun,Mexico,en
2022-12-21,4,Randomly added additional charges after stay and over charged on rooms. One night for 2 basic rooms ended up costing £495 compared to the £287 Expedia quoted,Warwick Geneva,Geneva,Switzerland,en
2022-12-21,10,Beach food swimming pool,Grand Fiesta Americana,Cancun,Mexico,en
2022-12-21,10,We like the beach swimming pool food,Grand Fiesta Americana,Cancun,Mexico,en
2022-12-20,10,Great services anf facility. Highly recommended!,Grand Fiesta Americana,Cancun,Mexico,en
2022-12-19,10,We had a great time at this resort. The staff were very friendly. The food was amazing and the amenities and entertainment kept us having fun the entire time.,Grand Fiesta Americana,Cancun,Mexico,en
2022-12-19,10,Our family enjoyed every minute of our stay. Such a beautiful place !!!,Grand Fiesta Americana,Cancun,Mexico,en
2022-12-19,10,Best service they got,Grand Fiesta Americana,Cancun,Mexico,en
2022-12-18,10,Great place to stay. People are very welcoming and helpful. One of the best experiences we have had in recent times. Will come back again soon.,Grand Fiesta Americana,Cancun,Mexico,en
2022-12-18,6,Restaurant was always booked,Grand Fiesta Americana,Cancun,Mexico,en
2022-12-18,10,Had a wonderful stay. Property is inviting; comfortable; staff are friendly and not invasive. You feel at home. Love that the resort is open to families; diversity; lgbtq; pet friendly all of it. Very inclusive feel. This is our go to in Cancun. Beach is numero uno.,InterContinental Presidente,Cancun,Mexico,en
2022-12-18,6,"Be careful when booking this hotel.  Call first to find out if they are doing any repairs or painting or in our case VARNISHING.  The fumes from varnishing was so strong as if it was coming through the air ducts directly into our room on the fifth floor.  We endured this for 2 days until the supervisor switched us to a different room.  We paid for a club level then had to move to a basic room in the tower.  Their commercial shows a high level of customer service and ""Luxury"".  There front desk staff is NOT trained to handle situations like this for a SUPPOSED world class hotel.  I have stayed here before and noticed that basically guest are supposed to accept whatever inconveniences arise and without any warnings....It's so unprofessional and it shows NO CLASS....they were even bleaching the pool area walkway while we were walking to have dinner and stepping on the bleached water they were rinsing....and this was early in the evening...they could have done that later when everyone was asleep like other resorts do....Anyway;  My last stay has left me confused now on how this place should be rated.  Was it  a down time so they have to do some repairs or touch-ups but what about the guest who stay during those down times?  And they waited to give us another room...and had to settle for a basic room when I paid more for our club level room and the problem was caused by the hotel....Be careful with this hotel everyone!",InterContinental Presidente,Cancun,Mexico,en
2022-12-17,8,Wir haben dort nur geschlafen. Alles war freundlich und effizient. Die Lage gleich neben dem Bahnhof macht das Reisen einfach.,Warwick Geneva,Geneva,Switzerland,de
2022-12-16,10,Outstanding property and great location.  Service; room and facilities were all excellent.,Grand Fiesta Americana,Cancun,Mexico,en
2022-12-16,2,Smells so bad,Grand Fiesta Americana,Cancun,Mexico,en
2022-12-16,4,El hotel está increíble en todos los aspecto Però nos desaparecieron un dinero de la caja de seguridad y esto borró lo increíble de un solo golpe fue muy triste la verdad,InterContinental Presidente,Cancun,Mexico,es
2022-12-15,10,About a 15 minute walk from anything you need (train station; high fashion shopping; central public park) and right in front of the sea!  15-minute bus or taxi to the airport and being further from the train station means a more relaxed/peaceful neighborhood.  Rooms are spacious and fancy with everything you need; and the indoor/outdoor heated pool is amazing!,Hyatt Regency Palais,Nice,France,en
2022-12-15,4,The hotel is very old; outdated.,Warwick Geneva,Geneva,Switzerland,en
2022-12-14,10,The dining options were fabulous.  Staff was extremely friendly and professional.  The SPA experience was FABULOUS.  The check in was quick and detailed.  The grounds are very beautiful and clean.  I would HIGHLY recommend staying here.,Grand Fiesta Americana,Cancun,Mexico,en
2022-12-14,10,This property was amazing! Although they had multiple restaurants; the food in the buffet was delicious every night. Staff was very friendly; and cleaned the property all day. Our room was cleaned multiple times a day. That was shocking; but appreciated. Will be back!,Grand Fiesta Americana,Cancun,Mexico,en
2022-12-12,10,Fantastico… le stanze le stanno ristrutturando,Fairmont Monte Carlo,Monaco,France,it
2022-12-12,10,Tres bien personnel charmant et à l’ecoute. Un établissement à recommander.,Hyatt Regency Palais,Nice,France,fr
2022-12-12,10,First trip to Cancun and I felt like I chose a good property to stay at I love the hotel,Grand Fiesta Americana,Cancun,Mexico,en
2022-12-12,10,Staff were so friendly and place was perfect,InterContinental Presidente,Cancun,Mexico,en
2022-12-11,10,The service and food are great no complaints,Grand Fiesta Americana,Cancun,Mexico,en
2022-12-11,10,I was on vacation with my wife for our anniversary celebration. We couldn't ask for more. The quality and standards are top notch. The staff is very friendly and accomodating. They don't charge you hidden fees and try to sell anything fishy. Thank you for making our stay memorable.,Grand Fiesta Americana,Cancun,Mexico,en
2022-12-11,10,La playa es excelente; la mejor.,InterContinental Presidente,Cancun,Mexico,es
2022-12-10,10,Alway amazing here!   The water is so Chrystal clear.  Isla Contoy is hands down the best restaurant with the best view.   Going back again in March.,Grand Fiesta Americana,Cancun,Mexico,en
2022-12-10,8,Dood was good. Entertainment was quite good. The music in the restaurants abd lobby was way too loud. When people were eating; they couldn't even carry on a conversation. I would definitely recommend it be turned down; especially in the restaurant s,Grand Fiesta Americana,Cancun,Mexico,en
2022-12-09,8,nice place to stay. best thing about it is its location; just across the street from the Cornavin Central train station; easy access to everything you may need. Good staff and breakfast too.,Warwick Geneva,Geneva,Switzerland,en
2022-12-09,8,Perfectly good place to stay - wonderful staff with great hospitality. Very helpful in all ways. Great beach. The room I stayed in could use a little updating / polishing; but was nice (and a very affordable rate) - no major complaints at all. The bar closes at 11pm through; which was a slight disappointment. I recommend staying here - it is well worth it.,InterContinental Presidente,Cancun,Mexico,en
2022-12-08,10,All staff were very friendly and helpful. Our overall experience was great!,Grand Fiesta Americana,Cancun,Mexico,en
2022-12-08,10,La limpieza; el servicio; especialmente de rossy la mucama; Miguel el encargado del desayuno y el bartender en el club room,InterContinental Presidente,Cancun,Mexico,es
2022-12-07,6,good location; but noisy.,Warwick Geneva,Geneva,Switzerland,en
2022-12-06,10,Stylish and well presented hotel near the central train station in Geneva; Warwick Geneva provides a high quality hotel; with well thought out rooms and the excellent customer service a seasoned traveller expects. You can't beat the location with shops and restaurants to all tastes within an easy walk. A short walk to Lake Geneva and easy public transport links means you are able to explore without difficulty. Hotel staff were outstanding; from reception to concierge to cleaning staff. The room was remarkably quiet although the hotel was busy. My three night stay was without fault and the cost is very good value for this quality.,Warwick Geneva,Geneva,Switzerland,en
2022-12-06,10,The service was top of the top. The food was amazing. Everything about the hotel was great definitely will stay at the hotel again,Grand Fiesta Americana,Cancun,Mexico,en
2022-12-05,10,We enjoyed a lot our stay at Grand Fiesta Americana. Everything is kept spotless clean and the personnel does a great job to accommodate the guests’ needs. There is a good variety of food and drinks. The nightly shows are pretty entertaining. The overall atmosphere is relaxing; exactly what you would expect to find for a vacation.,Grand Fiesta Americana,Cancun,Mexico,en
2022-12-04,10,Very good hotel.  excellent service. nice physically.  nice pool area.  good beach,InterContinental Presidente,Cancun,Mexico,en
2022-12-02,6,Kids were allowed in adult areas. Too many crying and screaming baby’s and kids at booked dinner reservations. Rooms little outdated and mirrors in bathroom deteriorating and mold ruined shower doors. Most employees do go over and above to help and service.,Grand Fiesta Americana,Cancun,Mexico,en
2022-12-01,8,internet did not work for first hour...had to have doorman help with fixing problem,Warwick Geneva,Geneva,Switzerland,en
2022-11-29,10,Excellent location; and concierge staff. Rooms; and bathrooms are dated. Cleanliness of daily housekeeping was mediocre.,Hyatt Regency Palais,Nice,France,en
2022-11-29,10,We absolutely loved this resort. Definitely coming back.,Grand Fiesta Americana,Cancun,Mexico,en
2022-11-29,10,Overall it was wonderful; staff; food; property; etc,Grand Fiesta Americana,Cancun,Mexico,en
2022-11-28,10,service was amazing.,Grand Fiesta Americana,Cancun,Mexico,en
2022-11-27,10,I stayed with family in Grand Feista Americana resort and it’s luxurious resort.we loved it excellent hospitality; and many restaurant good food 24/7 room service. kids friendly resort. Best place for relaxing and pampering and pampering Vacation!,Grand Fiesta Americana,Cancun,Mexico,en
2022-11-27,10,All staff members were very friendly and professional. We were always very well  taken care of. The hotel was very clean and smelled fresh and nice every where. The beach and pool was super clean and very safe.,Grand Fiesta Americana,Cancun,Mexico,en
2022-11-27,10,Great place for families. Nice restaurants with lot of options; excellent beach and pools; kids club; wonderful rooms!,Grand Fiesta Americana,Cancun,Mexico,en
2022-11-27,10,Everyone at this resort goes over and beyond great customer service. Usually; resorts don’t have the best food; but this hotel has great food. The location is superb. Walking distance to night life.  But the best; best part of the hotel has to be the beach.  You will not regret staying here. You will definitely enjoy this resort.,InterContinental Presidente,Cancun,Mexico,en
2022-11-26,10,Great stafff,Warwick Geneva,Geneva,Switzerland,en
2022-11-26,10,Absolutely beautiful! Staff was amazing and felt like family! Forgot my phone on a day excursion; Isaac(staff) made contact with the company immediately along with Cancun Adventure at hotel and my phone was returned to me with my I.d. and credit card within 24 hrs. No damage or attempts with my bank card. So grateful!!!! I’m not sure I could stay else where on a return trip❤️,InterContinental Presidente,Cancun,Mexico,en
2022-11-25,10,Hotel staff are helpful. I stayed at a standard room. It could use an update; but it was clean and good size.  The hotel is located across Promenade de Anglais and close to a lot of restaurants. A few minutes walk and you could visit Massena Museum. It’s also close enough to old town Nice and Castle hill Garden as well. I had an amazing stay.,Hyatt Regency Palais,Nice,France,en
2022-11-25,10,Excellent hotel design. Nice and hard working people in restaurant.,Grand Fiesta Americana,Cancun,Mexico,en
2022-11-22,8,Nice property and extremely friendly staff. The rooms were nice but more 4-star than 5-star. Great location; everything is close by.,Fairmont Monte Carlo,Monaco,France,en
2022-11-22,10,Loistava hotelli hyvällä paikalla. Aamupala kattava ja maittava. Ystävällinen palvelu. Hyvä ilmastointi ja muutenkin mukava huone.,Hyatt Regency Palais,Nice,France,fi
2022-11-22,10,Me encanto el excelente servicio y amabilidad que tienen todos; los felicito que excelente personal,Grand Fiesta Americana,Cancun,Mexico,es
2022-11-22,10,The staff here was amazing. We felt like royalty the whole time.,Grand Fiesta Americana,Cancun,Mexico,en
2022-11-21,10,The cacino and the location close to everything,Fairmont Monte Carlo,Monaco,France,en
2022-11-21,2,We have stayed here in the passed and we only had good reviews but after this time. We are no longer coming back. Staff was rude and ugly towards us no costumer appreciation.,InterContinental Presidente,Cancun,Mexico,en
2022-11-20,10,Very nice facility and great spa,Grand Fiesta Americana,Cancun,Mexico,en
2022-11-18,8,The staff was much too helpful.,Grand Fiesta Americana,Cancun,Mexico,en
2022-11-16,10,Au niveau de l hôtel tout était parfait. Les travaux à promîtes ont un casser l ambiance très chaleureuse de l établissement.,Fairmont Monte Carlo,Monaco,France,fr
2022-11-14,8,中心部まで歩いて5分ほどですが、ゆっくり出来ました,InterContinental Presidente,Cancun,Mexico,ja
2022-11-13,10,I have stayed here twice; once about 10 years ago; and last week. This place was fantastic; then and now. The food is excellent; the beach gorgeous; and the staff incredibly helpful and friendly. Eduardo in the restaurant and Cristian on the front door were particularly helpful. We will definitely be back!,InterContinental Presidente,Cancun,Mexico,en
2022-11-11,10,The resort was great! The staff were very nice and helpful/ i wish there would of been more lunch options or a better lunch buffet.,Grand Fiesta Americana,Cancun,Mexico,en
2022-11-11,10,There was a lot of things to do at the resort as well as excursions to book through the resort! The food was amazing and so was the room service!,Grand Fiesta Americana,Cancun,Mexico,en
2022-11-10,10,The special handling and front desk staff especially Luke were fantastic; quality of people on property were unbelievable; well trained empowered staff. A fabulous property to stay at.,Fairmont Monte Carlo,Monaco,France,en
2022-11-10,8,Excelente desayuno buffet,Warwick Geneva,Geneva,Switzerland,es
2022-11-09,10,Great location along the waterfront.,Hyatt Regency Palais,Nice,France,en
2022-11-09,8,It’s close to the train station and to everything .,Warwick Geneva,Geneva,Switzerland,en
2022-11-09,10,The place was pretty awesome. All employees were accommodating and friendly. David and Gustavo in the Italian restaurant were perfect. Food was fantastic. Pool is the best I have been to. Overall great place.,Grand Fiesta Americana,Cancun,Mexico,en
2022-11-08,6,I would give it a general OK.  As soon as we checked in we were whisked away by the rewards Live Aqua folks to try to get us to sign up for their fiesta americana program.  I kepts saying no thank you but every morning for the first three days he would come grab us the moment we stepped off the elevators trying to persuade us with free massages and such.  We traveled with a small child and did not want to buy into whatever he was selling.  They stopped trying the last two days of our vacation.  Food was nice but we had reservations to Tuscany and they handed us a drink menu and said none of them were included in the price.  They also handed us a QC code for the menu and we did not have phones as we dressed up for a nice night out.  We also had our 3yr old and i could have sworn they said no extra charges at this location...we felt terribly out of place.  We ended up leaving and going to the buffet across the hall instead.  Pool was nice; room was a bit cool and moiste.  There was a wild cat sleeping on the beach chairs so that was entertaining.  We were hoping to go to kids club with our 3yr old so he could play but they wouldnt let us in.  We didnt want to leave him there as he is not potty trained but wete hoping he could paint and play with us supervising but they said no.  Not a great place for people with toddlers.  The beach was lovely so maybe we will return someday when our child is older.,Grand Fiesta Americana,Cancun,Mexico,en
2022-11-08,8,La playa esta excelente; limpia y amplia. El servicio es de primera; la amabilidad de todos es excelente. Creo que podrían modernizar más las habitaciones; la comida es excelente pero los precios son excesivos,InterContinental Presidente,Cancun,Mexico,es
2022-11-06,10,Staff was nice,Fairmont Monte Carlo,Monaco,France,en
2022-11-06,10,From the moment we got there; this place was top notch. Staff is super friendly and always there to help you enjoy your stay. The food and drinks in the all inclusive was outstanding. Everything is clean and kept perfect. I highly recommend staying here.,Grand Fiesta Americana,Cancun,Mexico,en
2022-11-06,10,Excelentes instalaciones y personal muy amable,Grand Fiesta Americana,Cancun,Mexico,es
2022-11-06,10,5 stars! One of our best vacations and such an easy place to relax. The food was fantastic; service was amazing; spa was wonderful and location was conveniently locate. Our stay was so great that we are considering having our wedding here!,Grand Fiesta Americana,Cancun,Mexico,en
2022-11-06,10,Agradable y personal muy amable,InterContinental Presidente,Cancun,Mexico,es
2022-11-06,10,Agradable y personal muy amable,InterContinental Presidente,Cancun,Mexico,es
2022-11-05,10,"I gave this property an overall ""Excellent"" rating.  Most of the staff really goes out of their way to make it an awesome experience.  But; here's a couple of areas for suggested improvement.  First; the wristband policy is somewhat stringent.  On our last night my son's wristband came undone when we were dining inside the resort and he set it on the table.  It went missing and would've cost $100 dollars to replace; so we opted not to have it replaced since it was our last night.  He went out that night with his 2 brothers and when they came back at 2am he was initially not allowed to re-enter the premises(took a lot of persuading).   Second;  hotel staff quoted us a taxi price back to airport that was comparable to Smile & Go (little over $30);  The price was that we were actually charged was twice that; around $60 dollars.   That being said; I would still book again but with more caution.",Grand Fiesta Americana,Cancun,Mexico,en
2022-11-05,10,Great property; great people; best beach in Cancun.,InterContinental Presidente,Cancun,Mexico,en
2022-11-05,10,Great property; great people; best beach in Cancun.,InterContinental Presidente,Cancun,Mexico,en
2022-11-04,10,Thanks,barriere-le-majestic,Cannes,France,en
2022-11-04,10,Wir waren nun schon 3x im Barrière und die Qualität hat sich in den letzten Jahren auf hohem Niveau gehalten. Das Personal ist super freundlich und hilfsbereit; das Hotel top in Schuss und die Lage direkt an der Croisette könnte nicht besser sein. Schön ist auch; dass das Personal nicht so häufig wechselt; einige Mitarbeiter kennen wir schon seit über 4 Jahren. An dieser Stelle ganz liebe Grüße an Fanny aus der Guest Relation und Thierry vom Concierge.,barriere-le-majestic,Cannes,France,de
2022-11-01,10,My family had a great time! The beach and pools were great. The kids like the kids club. The most important was the customer service was great. We had the pleasure of meeting Mr. Gurrola and he really cares about the resort and is trying make sure everyone has an amazing experience. We also loved the Italian restaurant especially Violonist Carlos. He played very nicely and we went almost every night  to hear him play. This was one of the nicest resorts we’ve ever been at.,Grand Fiesta Americana,Cancun,Mexico,en
2022-11-01,10,We adored the bartenders at the beach bar!  They are the best.  The water; sand and sun are hard to beat.  It's like swimming in a warm; calm pool; but it's the ocean!,InterContinental Presidente,Cancun,Mexico,en
2022-11-01,10,We adored the bartenders at the beach bar!  They are the best.  The water; sand and sun are hard to beat.  It's like swimming in a warm; calm pool; but it's the ocean!,InterContinental Presidente,Cancun,Mexico,en
2022-10-31,8,personnel à l'écoute et agréable; mais les chambres sont trop petite et la piscine n'est pas à la hauteur du palace,barriere-le-majestic,Cannes,France,fr
2022-10-31,10,Loved it !! We visited during the UK October half term 2 adults 2 kids. Weather was HOT HOT HOT. It showed at 31 but felt like 50!! Pools were clean; hotel was spotless; staff are very friendly and welcoming. Easy Beach access; tidy and staff on hand. Breakfast and Food selection is so yummy and full of variety. We attended a Mexico theme night on a Friday; amazing but must book in advance. My daughter has Coeliac Disease ; the F&B team was very supportive and made a number of options for her. We booked a tour at the hotel; staff explained all was very reassuring and the day was a success!! Spa was slightly pricey; treatment was good. We booked a private transfer separately with Expedia so didn't use the hotel one.,Grand Fiesta Americana,Cancun,Mexico,en
2022-10-30,8,Great location next to the train station. Friendly staff,Warwick Geneva,Geneva,Switzerland,en
2022-10-30,10,Yes this resort is 20 years old. However; the place is spotless and the food; drinks & service are 5 star! Great selection of places to eat and evening entertainment. Thanks for a great spot for our honeymoon.,Grand Fiesta Americana,Cancun,Mexico,en
2022-10-29,10,Love love love this hotel. My Cancun go to hotel.,Grand Fiesta Americana,Cancun,Mexico,en
2022-10-28,10,This place is amazing!,Grand Fiesta Americana,Cancun,Mexico,en
2022-10-28,10,I come to Cancun a lot. This is my favorite property. There is a beach. No waves. Everything was great,InterContinental Presidente,Cancun,Mexico,en
2022-10-28,10,I come to Cancun a lot. This is my favorite property. There is a beach. No waves. Everything was great,InterContinental Presidente,Cancun,Mexico,en
2022-10-27,8,Great breakfast amazing location we had a nice room with a Mountain View,Hyatt Regency Palais,Nice,France,en
2022-10-27,10,This place is amazing ! The staff was so nice and helpful. Everything is so clean. The spa is amazing. My favorite was all the restaurants available in the hotel; the food was delicious ! I have zero complaints!,Grand Fiesta Americana,Cancun,Mexico,en
2022-10-27,6,Instalaciones muy bonitas sobre todo las piscinas; la playa espectacular; el servicio del personal muy bueno.  Lo malo el ambiente pesimo ni ponene musica en las piscinas o instrumental.   La comida no es muy buena es  lo mismo en todos los restaurantes y muy comercial. Las bebidas hay de todo aunque se nota que los cocteles son de empaque  y no los preparan naturales. El entretenimiento en las noches pesimo. Creo que le falta alegria al hotel sin perder la elegancia.,Grand Fiesta Americana,Cancun,Mexico,es
2022-10-26,2,A garden view consists of one tree in a circle view of other rooms. Awful; as there is no view. Plus the maid stole my clothes. Missing was my Karl Lagerfeld blouse with pearl buttons and a silver thread sweater v-neck top. I complained to the hotel and they said they didn't take responsibility! Never recommend this hotel!,Fairmont Monte Carlo,Monaco,France,en
2022-10-26,8,Love the FM MC and have been a regular guest for years. Its tired but  they know this as major/complete refurb underway. Not too intrusive and will be great when done. New; 2nd pool will be built to (not until 2025 or so) to give another option to the full time Nikki Beach set up on the roof.,Fairmont Monte Carlo,Monaco,France,en
