date,rating,description,hotel_name,city,country,language
2022-03-22,10,Pretty old building it seems; but very well maintained and very clean. If it gets full to the capacity (which happened during our March-break stay); it gets pretty busy and hard to get a spot under a shade; although staff is doing great job trying to please customers. Beach is great; almost no seaweed at least during our stay. Pools are amazing too. Food is good and plenty; buffet does not have too many options though; best to book all restaurants and that way have variety during dinner time. Overall very pleased with first stay in Mexico; thank you.,Grand Fiesta Americana,Cancun,Mexico,en
2022-03-22,8,Hotel muy recomendable ; tranquilidad; buen servicio ; excelente playa .,InterContinental Presidente,Cancun,Mexico,es
2022-03-21,10,This has been our favorite hotel in Cancun for many; many years. Unfortunately due to the pandemic and some changes in the way the hotel does business; it has gone downhill somewhat. One of the things we did not like at all is that is has gone all-inclusive. That diminishes the quality of the food served in the restaurants. Also; service in the pool area could have been better. Staff was attentive once you got their attention; but there simply weren't enough of them to attend to all the guests around the pool. The hotel; however; is very conveniently located and the beach is great because it doesn't have as much current as the other hotels further down the coast have.,Grand Fiesta Americana,Cancun,Mexico,en
2022-03-21,8,It was clean and relaxing. The pools were great and there was always a place with shade when needed. The service was great and friendly. The only negative was the lack of top shelf liquor and the food was just ok.,Grand Fiesta Americana,Cancun,Mexico,en
2022-03-21,10,Great time; customer service; cleanliness and location are awesome! We will definitely  be back!,Grand Fiesta Americana,Cancun,Mexico,en
2022-03-20,6,Check in was horrible. Theft let too many people have late check outs. Room took hours to be ready; even after we were told it would be ready.,Warwick Geneva,Geneva,Switzerland,en
2022-03-20,10,This is an AMAZING resort with wonderful food and a beautiful beach.  The staff is outstanding!  And we especially loved the entertainment and live music.,Grand Fiesta Americana,Cancun,Mexico,en
2022-03-20,4,Well where do I begin … when we arrived at the hotel the check in process was very unpleasant. The guy attending us seemed to be in a bad mood . Other stays I’ve enjoyed over the years the check in process was smooth and great . The sales pitch right after we received our room keys was annoying and the guy was not taking no for an answer til we were firm with him . Things were going great til they tried kicking me out of the room a day early . I had booked a two bedroom suite which was very misleading since it’s just a connecting room with a door in the middle. They tried kicking me out one of the conjoined rooms and I had to go argue with the front desk which was time consuming and distasteful since they came into our room twice without asking and or knocking and my young daughter was there alone which I didn’t like . How ever it gets worse. We had a group of our friends come with us which we’re staying in another two rooms on a separate floor and towards the end of the night they would hang out on the balcony having drinks in on of the rooms . Well to their surprise on one of the nights while being on the balcony a man that was hotel staff was on my friends balcony since he figured no one was there ! No privacy man . How many people have access to the room other than the room cleaning people ?! I’ve been to Cancun enough times and I can honestly say I did not feel safe in this hotel what do ever . Very disappointed to the degree if they gave me a week free here I’d deny it.,Grand Fiesta Americana,Cancun,Mexico,en
2022-03-20,6,We like how close it is to clubs in town,Grand Fiesta Americana,Cancun,Mexico,en
2022-03-19,6,一言で素晴らしいホテルでした。ただ、朝食が日本人の口に合わないのか、ただ、不味いのかは、分からないのですが、本当においしくなかったです。,Hyatt Regency Palais,Nice,France,ja
2022-03-19,10,Very Friendly staff. Very attentive to COVID precautions. Very clean.,Grand Fiesta Americana,Cancun,Mexico,en
2022-03-19,6,Did not like it,Grand Fiesta Americana,Cancun,Mexico,en
2022-03-19,10,Property is very well kept.. food is great... All pools are heated.. beach is really nice.. staff is very friendly and helpful... Rooms are very clean and in good shape... Hotel has a very relax environment... plenty of restaurants to try... it is worth the price excellent value for the money...,Grand Fiesta Americana,Cancun,Mexico,en
2022-03-19,10,We loved everything about the property.  Simple modern elegance in the design.  The restaurants; especially Le Cap; are wonderful.  Two pools with plenty of thatched umbrellas.  The beach is a step away from the pools.  I usually like to see TVs at the outside bar in case a sports event is on but I understand if they want all focus away from that because it’s vacation.,InterContinental Presidente,Cancun,Mexico,en
2022-03-19,6,Buen lugar poco personal  3 horas esperando habitación !!,InterContinental Presidente,Cancun,Mexico,es
2022-03-18,8,Situated 50 meters from the train station; it was perfect for our connections the next day. Nice hotel. A little lacking in character but typical of a big chain hotel. Buffet breakfast was cold. Nice enough stay and suited our purposes for 1 night layover,Warwick Geneva,Geneva,Switzerland,en
2022-03-17,10,Steps away from train station,Warwick Geneva,Geneva,Switzerland,en
2022-03-17,10,First time experience was nothing short then perfect. Will be back !,Grand Fiesta Americana,Cancun,Mexico,en
2022-03-17,8,Not too big but very clean friendly and quiet. Good breakfast. Bed is very comfortable.,InterContinental Presidente,Cancun,Mexico,en
2022-03-16,8,Check in was my least favourite experience; treated as if we could not afford to stay at this hotel. Staff not particularly friendly except for one staff member in the breakfast room on our last morning.,Fairmont Monte Carlo,Monaco,France,en
2022-03-15,10,The staff was very good. Beautiful surroundings. Would highly recommend to family and friends,InterContinental Presidente,Cancun,Mexico,en
2022-03-13,10,Excellent location right next to the train station,Warwick Geneva,Geneva,Switzerland,en
2022-03-12,8,Great hotel with the best beach in Cancun. Pool and beach area were big and clean. Rooms were good; nothing special but definitely worth the price. Lovely staff but could have gotten more info about the premises; restaurants and the area. Overall a great stay!,InterContinental Presidente,Cancun,Mexico,en
2022-03-11,10,I've stayed at various hotels (all 4 stars and above) in Cancun; and InterContinental is the best hotel because of its beautiful; clean beach; clean pools; excellent services and good food. I love and Cancun and InterContinental Presidente hotel!!!,InterContinental Presidente,Cancun,Mexico,en
2022-03-10,8,호텔에서 회의가 있었던 국제기구 간에 트램이 있어서 참 편리했습니다. 하루에도 몇번씩 숙소를 오갈 수가 있어서…,Warwick Geneva,Geneva,Switzerland,ko
2022-03-07,10,Danke für gute Empfang; sehr schönes Zimmer; ruhig und sauber; gute Lage und gerne wieder. 👌👌👌👌👌. Beste Hotel die ich je gehabt habe 😍👌,Warwick Geneva,Geneva,Switzerland,de
2022-03-06,10,The staff was so kind and helpful.  The beach area is groomed to perfection.   We l9ve staying at this resort!  Will definitely return next year!!,InterContinental Presidente,Cancun,Mexico,en
2022-03-05,10,Area rugs on the floor the floor cold.  And can hear every conversation in the rooms and hallway,InterContinental Presidente,Cancun,Mexico,en
2022-03-05,8,Optamos pelo Intercontinental por ser uma rede internacional; não tivemos grandes problemas em relação ao hotel; o problema foi que os hóspedes guardavam as cadeiras e guarda sol da praia com toalhas; então quando você chegava para pegar uma prainha; não haviam mais cadeiras e guarda-sol; os bangalôs são pagos a parte. O erro do hotel é não ter cadeiras e guarda sol suficiente para todos os hóspedes na praia. Bem localizado e praia boa. O nosso quarto tinha um pouco de cheiro de umidade.,InterContinental Presidente,Cancun,Mexico,pt
2022-03-04,10,Premises are on point. Staff is very friendly. =o),InterContinental Presidente,Cancun,Mexico,en
2022-03-02,10,Amazing hotel friendly staff and very close to the beach,InterContinental Presidente,Cancun,Mexico,en
2022-02-28,10,Pratique et propre,Warwick Geneva,Geneva,Switzerland,fr
2022-02-27,8,Aesthetically pleasing property,InterContinental Presidente,Cancun,Mexico,en
2022-02-27,10,Great choice for pets.,InterContinental Presidente,Cancun,Mexico,en
2022-02-26,10,El desayuno muy bueno ; variado y muy rico,InterContinental Presidente,Cancun,Mexico,es
2022-02-26,6,I loved the beachfront; the sand and water is amazing. The room wasn't that great and the food choices weren't that great either. The drinks were watered down. I wouldn't stay again for the price we paid.,InterContinental Presidente,Cancun,Mexico,en
2022-02-25,10,Lobby man; check in ; check out; hotel property; breakfast; all professional; so I didnt except less than this from intercontinental 🌺❤️,InterContinental Presidente,Cancun,Mexico,en
2022-02-24,10,The moment you enter the lobby you are greeted by amazingly friendly and professional staff.  They have a fantastic fragrance in both the lobby and the elevators that makes me smile.  Front desk people were helpful but Greg in Concierge was as good as they come.  He spent time on locating a pharmacy; airport transfers; restaurants ; Carnaval tickets; train schedules and more and never seemed in a hurry despite always being busy.  I didn't eat at the restaurant but there were always patrons and especially on Valentine's Day when they put out extra tables and they were all filled.  Something must have been great.  Lucille was very helpful and kind in the bar.  She took extra time to help me with my French.  The location is so nice with being just across from the Promenade des Anglais.  Oh; the rooms were very nice and very clean.,Hyatt Regency Palais,Nice,France,en
2022-02-22,10,Muy bien en términos generales del lugar; solo que al ser mexicanos sentimos que tenían mayor preferencia por el extranjero!! En ciertos detalles de los Buffets; el bar nos sentimos ignorados fuera de eso el hotel de 10,InterContinental Presidente,Cancun,Mexico,es
2022-02-21,2,Faltam cadeiras na area.aa piscina e na praia; hospedes mal educados e egoístas deixam toalhas ondia todo nas cadeiras as reservando enquanto outros hospedes nao temnonde sentar; o hotel nao toma providência nenhuma; constatei o mesmo problema 3 dias seguidos; ou o hotel disponibiliza mais cadeiras; ou deveria controlar e nao permitir esse tipo de condulta; senti falta de uma jacuzzi de água quente também.,InterContinental Presidente,Cancun,Mexico,pt
2022-02-19,8,Toilet was broken before we came in but was sorted straight away,InterContinental Presidente,Cancun,Mexico,en
2022-02-18,10,Todo excelente,InterContinental Presidente,Cancun,Mexico,es
2022-02-14,10,Magnifique vue sur la mer. Personnel excellent; au petit soin. Je recommande,Fairmont Monte Carlo,Monaco,France,fr
2022-02-12,10,Customer service was excellent. If there’s anything I would recommend is coming up with a system that identifies current guest that are staying there so we don’t have to wait on the street for security to clear the gate for us.,InterContinental Presidente,Cancun,Mexico,en
2022-02-12,10,Coolest beach nearby! Great place :),InterContinental Presidente,Cancun,Mexico,en
2022-02-11,6,Entrance ramp is too steep. Exclusive dinning is in the middle of the lobby. Making all that did not pick this feature feel like send class. The main restaurant can’t be exclusive.,InterContinental Presidente,Cancun,Mexico,en
2022-02-10,4,Only the location is very good but the hotel is not 4 star hotel at all,Warwick Geneva,Geneva,Switzerland,en
2022-02-09,10,Very friendly and helpful staff,Hyatt Regency Palais,Nice,France,en
2022-02-08,8,對於第二天要去搭飛機的人很方便及適合,Warwick Geneva,Geneva,Switzerland,zh
2022-02-08,10,this have to be the most comfortable beds I've ever slept on ultra soft,InterContinental Presidente,Cancun,Mexico,en
2022-02-07,8,Central location; quiet & calm although close to the train station. Very helpful & friendly personnel. Very clean room & bathroom. I enjoyed my stay overall.,Warwick Geneva,Geneva,Switzerland,en
2022-02-07,10,Hotel excelente; camas confortáveis; chuveiro maravilhoso; otimo staff; ótimo local de home office; sem contar a praia belíssima; restaurantes ótimos; otimo spa e boa localização.,InterContinental Presidente,Cancun,Mexico,pt
2022-02-04,10,Un lugar muy familiar y la atención del personal excelente,InterContinental Presidente,Cancun,Mexico,es
2022-02-02,10,Great hotel and excellent service by all employees. Would definitely recommend to all my friends and family.,InterContinental Presidente,Cancun,Mexico,en
2022-01-31,10,This hotel is truly amazing. Before coming here; some of the other reviews had me second guessing it; but I’m glad I booked it. The hotel is located in a great area that offers an amazing beach access just a short walk from your room. The staff is extremely friendly and welcoming. We had dinner and breakfast at the main restaurant and the staff always went above and beyond to make us feel great. Our waiters Gustavo and David were amazing. They greeted us every day as if they we’re truly happy to see us. They even sang my wife happy birthday and brought us a complimentary dessert. I would recommend this place to anyone that wants a great experience in Cancun.,InterContinental Presidente,Cancun,Mexico,en
2022-01-31,10,Great,InterContinental Presidente,Cancun,Mexico,en
2022-01-30,10,Clean and. Nice services,InterContinental Presidente,Cancun,Mexico,en
2022-01-28,10,service and location are perfect,InterContinental Presidente,Cancun,Mexico,en
2022-01-26,10,Excelente la atencion y el hotel muy familiar el personal es impecable,InterContinental Presidente,Cancun,Mexico,es
2022-01-23,8,Otima opcao pelo hotel e sua praia.,InterContinental Presidente,Cancun,Mexico,pt
2022-01-18,10,Beautiful room with a view of the French Riviera! Everyone was so wonderful and helpful. Would absolutely stay here again.,Hyatt Regency Palais,Nice,France,en
2022-01-18,8,Proximity to the train & bus stations,Warwick Geneva,Geneva,Switzerland,en
2022-01-18,10,Nice rooms; nice pool; nice restaurants; nice beach - guess what? Nice hotel ;-),InterContinental Presidente,Cancun,Mexico,en
2022-01-17,10,Agréable,Warwick Geneva,Geneva,Switzerland,fr
2022-01-17,10,Friendly accommodating staff and beautiful property in the hotel zone. Room with all amenities needed. Bigger white sandy beach than hotels nearby. Great pool/beach service. Quieter than the huge hotels. More like a boutique hotel. I stayed here last year and would return again.,InterContinental Presidente,Cancun,Mexico,en
2022-01-16,10,Ótima,Hyatt Regency Palais,Nice,France,es
2022-01-15,8,Location is great. Clean but noisy.,Warwick Geneva,Geneva,Switzerland,en
2022-01-11,2,Hotel confortável; mas que me cobrou; após o checkout; por produtos do mini-bar que não consumi. Mais de 240 reais foram cobrados em meu cartão. Já mandei e-mails e não tive resposta. Fiquei em hotéis de alto nível na mesma viagem; como o Estherea (Amsterdã) Splendid (Paris) e Opera (Zurique); dentre outros e isso nunca aconteceu. Estou tentando o ressarcimento e não obtive resposta. Estou estarrecida e não poderia imaginar que isso aconteceria em um hotel 4 estrelas.,Warwick Geneva,Geneva,Switzerland,pt
2022-01-10,10,The hotel was very clean. The staff was very friendly. It was also in a great location! Very easy to get around Geneva from the hotels location. Overall I had a very great experience at the Warwick Geneva.,Warwick Geneva,Geneva,Switzerland,en
2022-01-10,10,Perfect location; swimming pool and beach club are the perfection,InterContinental Presidente,Cancun,Mexico,en
2022-01-09,8,Muy bonito el hotel,Warwick Geneva,Geneva,Switzerland,es
2022-01-08,10,Amazing place for families with pets.,InterContinental Presidente,Cancun,Mexico,en
2022-01-07,10,Friendly stuff; comfy accommodations; A good choice of food for breakfast,InterContinental Presidente,Cancun,Mexico,en
2022-01-07,8,El hotel es muy bonito; sus instalaciones y playa tambien; pero la atención es muy mala; y la limpieza en la habitación malísima; el desayuno está bien tiene mucha variedad pero en una semana q estuve solo cambiaban un plato.,InterContinental Presidente,Cancun,Mexico,es
2022-01-06,10,Idéalement situé ; bon petit déjeuner ; propre,Warwick Geneva,Geneva,Switzerland,fr
2022-01-05,10,Gorgeous view of pool and ocean,Hyatt Regency Palais,Nice,France,en
2022-01-04,10,What a beautiful hotel! Everything was perfect.,Fairmont Monte Carlo,Monaco,France,en
2022-01-04,10,El hotel y el servicio es muy bueno. Está en buenas condiciones; el personal es amable y en general pasas un buen tiempo en familia. Quizá podrían remodelar algunas zonas para mantenerlo actualizado por que si se le empiezan a notar los años en algunas áreas. En general muy bueno; con precios razonables.,InterContinental Presidente,Cancun,Mexico,es
2022-01-04,6,What I dislike the most was THIS IS NOT AN ALL INCLUSIVE PROPERTY. Not sure why they’re even using the term all inclusive when the only thing that was included was breakfast. That is absolutely misleading. We only stayed three nights so it wasn’t a big deal but had we stayed longer we would’ve been extremely disappointed. The pool and beach area was beautiful - plenty of covered chairs to relax. The three whirl pools; while looked nice were not hot tubs which is totally useless to me. There was no entertainment on the property which was also disappointing. “Luz” the concierge young lady who’s name I’m probably misspelling was extremely nice and very helpful in helping us find some entertainment and other things; including scheduling our in room Covid test. she explained that the hotel is more of a business property so that may be my fault for not doing extensive research about the entertainment. The view from our room was gorgeous. The room could use a little updating as we can see scratches on the furniture and other size of old age but all in all for three nights it was fine. We also could only find two English-speaking channels on the television but again for three nights it wasn’t a big deal,InterContinental Presidente,Cancun,Mexico,en
2022-01-03,10,Very spacious & comfortable rooms; fantastic breakfast and relaxing pool area. Great hotel!,Hyatt Regency Palais,Nice,France,en
2022-01-03,8,It is good; nice 4 stars hotel; we have 4 ppl with two rooms attached could open door; very convenient; Hotel is comfortable; clean with good service. Price we paid for the 2 rooms is good less than 400 US dollar 👍,Warwick Geneva,Geneva,Switzerland,en
2022-01-03,10,El servicio de todo el personal es súper amable y profesional. Las instalaciones renovadas y muy cómodas; con una de las mejores y más tranquilas playas de Cancún.,InterContinental Presidente,Cancun,Mexico,es
2022-01-02,10,Emplacement idéal; pour profiter de la ville et de la plage à pied. Confort; service parfait.,Hyatt Regency Palais,Nice,France,fr
2022-01-02,4,For a USD$856 hotel room; I expected better. Perhaps something clean with nice room service? I am not a picky traveler; but the room was so tired that I questioned whether I had teleported. Stains everywhere. The breakfast was disappointing as well; so no; not worth it by a long shot. The only thing that saved this hotel for me was the nice beach; so if you'll be spending most of your time there; I suppose it could work out well. I stayed one night before I moved to another place. It was peak season so very few places were available; but I found a USD$63/night bed and breakfast with a better looking room where I spent the rest of my vacation.,InterContinental Presidente,Cancun,Mexico,en
2021-12-31,8,Good location. Free access to a commercial gym which is fully equipped and has les mills classes. Free transport card within Geneva.,Warwick Geneva,Geneva,Switzerland,en
2021-12-30,10,Really nice service staff,Hyatt Regency Palais,Nice,France,en
2021-12-30,8,Great location,InterContinental Presidente,Cancun,Mexico,en
2021-12-29,10,everything was excelent,InterContinental Presidente,Cancun,Mexico,en
2021-12-29,10,The staff was very friendly and helpful,InterContinental Presidente,Cancun,Mexico,en
2021-12-27,6,Quizá es la temporada pero mi check in a demás de lento; la persona que me atendió no fue nada amable y quería hacerme un cargo por adelantado de las habitaciones que reservé. No fue sino hasta que llegó la manager y lo aclaró que solo era en garantía. Fuera de un par de gentes muy amables y profesionales como el mesero del Club Intercontinental; la mayoría son inexpertos y no tienen el espiritu de servicio de simpre.,InterContinental Presidente,Cancun,Mexico,es
2021-12-27,10,Todo estubo perfecto; el personal del hotel muy amables. Fue un placer haber estado ahí!,InterContinental Presidente,Cancun,Mexico,es
2021-12-26,10,Very beautiful access to the beach. Very clean!! Room clean and updated! Great food! Service was very good!! So many nice people Miguel was very fun at dinner!! David at the Grill on the beach!! We Celebrated our son’s 16 th birthday and everyone was wonderful!! He was able to jet ski right at the property!! We were able to sign up for our activities with out hassle out side while just picking up towels for our beach day!  No pressure!!,InterContinental Presidente,Cancun,Mexico,en
2021-12-25,10,Easy access from train station. Clean. Kind and helpful staff.,Warwick Geneva,Geneva,Switzerland,en
2021-12-23,10,Superbe établissement; personnel au top; nous avons passé un très bon séjour,Fairmont Monte Carlo,Monaco,France,fr
2021-12-22,10,Excellent customer service;very beautiful hotel;I would recommend this hotel to anyone who loves beautiful spaces.,InterContinental Presidente,Cancun,Mexico,en
2021-12-21,10,Well maintained property facing the beach and close to pedestrian resto bar area.,Hyatt Regency Palais,Nice,France,en
2021-12-21,10,Hotellet ligger precis på stranden och kanske den bästa delen av stranden på denna sidan udden. Vi hade tillgång till lounge som var öppen mellan 18.00-20.00; helt ok utbud vad gäller dricka och mindre smårätter. Dock var servicen i loungen inte särskilt bra; massvis med tomma glas och tallrikar som stod överallt; trots att det var lite folk i loungen. Frukosten intogs i loungen; också helt ok utbud. Bra städning av rum. Knappt 10 minuters gångväg till downtown hotelarea där ett antal restauranger finns. Inget negativt föruton lite slapp service i barer och lounge; där mobiltelefonen verkar vara det viktigaste.,InterContinental Presidente,Cancun,Mexico,sv
2021-12-19,8,Hotel antiguo pero bien cuidado; con buena ubicación frente a la estación de Ginebra y muy cerca caminando de todo,Warwick Geneva,Geneva,Switzerland,es
2021-12-19,6,I liked how it was near the beach. What I didnt like was the hotel looks different from the picture; whereas in real life its old building. Also; there were too mucu noise. The staff were not helpful especially when I came alittle early to ask to be checked in early; I knew she had rooms available but she said No and told me to come back at 3. Also; Expedia lied about this property being all-inclusive; it wasnt...if I knew earlier; I would have booked elsewhere,InterContinental Presidente,Cancun,Mexico,en
2021-12-18,8,zentral; sauber ok,Warwick Geneva,Geneva,Switzerland,en
2021-12-17,10,The beach is beautiful; the staff wonderful. We would have loved a few more fruit and veggie options in the restaurants. But overall a very nice resort. I would recommend it to anyone wanting a nice family vacation.,InterContinental Presidente,Cancun,Mexico,en
2021-12-15,8,Chose the hotel due to reputation of Intercontinental brand and the non all-inclusive format. Great location and beach. Room was not ready for check-in at advertised time.,InterContinental Presidente,Cancun,Mexico,en
2021-12-14,10,Luxe hotel met veel fasciliteiten.,InterContinental Presidente,Cancun,Mexico,nl
2021-12-14,8,The resort was beautiful. The restaurants had very good food and the beach was excellent,InterContinental Presidente,Cancun,Mexico,en
2021-12-13,10,Hotel très bien situé; personnel adorable. comme d'habitude je reviendrai très vite,Fairmont Monte Carlo,Monaco,France,fr
2021-12-13,10,The location of the hotel; right next to the beach and promenade; is unbeatable. The old town can be reached in a few minutes on foot. The staff is very nice and helpful. The rooms leave nothing to be desired. Room 906 with a great view of the sea.,Hyatt Regency Palais,Nice,France,en
2021-12-13,2,The pool was nice,InterContinental Presidente,Cancun,Mexico,en
2021-12-12,6,Not very clean,InterContinental Presidente,Cancun,Mexico,en
2021-12-12,10,Las habitaciones normales; las amenidades muy buenas la playa muy limpia y la panaderia del restaurante muy rica,InterContinental Presidente,Cancun,Mexico,es
