date,rating,description,hotel_name,city,country,language
2018-12-07,10,What makes your stay is the amazing staff; from the concierge; to check-in to the best restaurant staff  You feel special when you stay here.,Fairmont Monte Carlo,Monaco,France,en
2018-12-04,10,Very nice hotel and front desk staff...casino is also amazing,Fairmont Monte Carlo,Monaco,France,en
2018-12-04,10,excellent location beach front; close to shopping and interesting tourist areas. concierge services very Helpful,Hyatt Regency Palais,Nice,France,en
2018-12-03,10,"Un des rares 5* de Nice. Localisation parfaite. Chambres grandes. Un vrai spa serait le dernier ""plus"" pour la perfection.",Hyatt Regency Palais,Nice,France,fr
2018-12-03,10,セントラルヒーティングなので、ちょっと寒かったです。,Warwick Geneva,Geneva,Switzerland,ja
2018-12-03,8,Request for twin beds ignored; moved rooms and broken ac,Warwick Geneva,Geneva,Switzerland,en
2018-12-02,8,Ottima posizione. Ottimi servizi. Ottima colazione.,barriere-le-majestic,Cannes,France,it
2018-12-02,10,The room is cream and staff is nice and kind,Warwick Geneva,Geneva,Switzerland,en
2018-11-30,10,The hotel is an excellent location; rooms are ample size and views are amazing. Would never go to another hotel when I’m in Nice again. Staff was very courteous especially the concierge ( Ask for Greg). Overall; our stay in the hotel was very comfortable and enjoyable and nothing negative to report.,Hyatt Regency Palais,Nice,France,en
2018-11-30,10,Excellent location. The tram stop is across the street. Comfortable rooms. Friendly staff. Excellent breakfast.,Warwick Geneva,Geneva,Switzerland,en
2018-11-30,10,very close to public transport and restaurants at a very reasonable price,Warwick Geneva,Geneva,Switzerland,en
2018-11-27,10,Nicely located hotel with friendly people in all services,Fairmont Monte Carlo,Monaco,France,en
2018-11-26,10,Wonderful service;  modern hotel. Excellent breakfast;  best Cosmo drink at the bar. Location is perfect.,Fairmont Monte Carlo,Monaco,France,en
2018-11-26,10,The service was very good; the room and view were amazing and it was right across from the train station and bus depots which is just what we needed.,Warwick Geneva,Geneva,Switzerland,en
2018-11-25,10,Loved that the hotel is conveniently located across from the train station. The staff was very helpful and friendly. The room was spacious enough for the two of us and clean.,Warwick Geneva,Geneva,Switzerland,en
2018-11-21,10,Passamos dois dias no hotel antes de pegar um cruzeiro em Mônaco ; amamos o hotel em todos os aspectos; excelente localização pois o navio ancorou exatamente em frente; quarto lindo com ótimo banheiro todo em mármore ; atendimento nota 10 desde a recepção a concierge. Um restaurante Nobu dentro do hotel tbém ; achamos tdo perfeito; só subir na lateral está no Cassino!!!,Fairmont Monte Carlo,Monaco,France,pt
2018-11-20,10,Très bon accueil; chambre spacieuse; et confortable.,Hyatt Regency Palais,Nice,France,fr
2018-11-20,8,Carino; ottima posizione,Hyatt Regency Palais,Nice,France,it
2018-11-19,10,As a world travel this hotel always delivers the highest standards in luxury and customer care. I have been going to this hotel for years and it’s alwsys a pleasureable experience. Thank you and I look forward to staying again soon :-),barriere-le-majestic,Cannes,France,en
2018-11-19,10,What a wonderful experience with the kids who loved the hotel. The staff all were world class 5* customer service. The kids play area has the most friendly entertaining two female staff who made the kids do not want to leave.,barriere-le-majestic,Cannes,France,en
2018-11-19,10,Albergo 5 stelle che  nulla lascia al caso. Bellissimi spazi comuni; personale sempre attento camere perfette.,barriere-le-majestic,Cannes,France,it
2018-11-18,10,Hög standard; centralt läge; utmärkta faciliteter; rent och fräscht.,barriere-le-majestic,Cannes,France,sv
2018-11-14,10,Very nice hotel at a prime location. Very friendly and helpful staff - would love to come back.,Hyatt Regency Palais,Nice,France,en
2018-11-14,8,Good experience.  Small hotel.  Clean.  Good location.  Staff friendly.,Hyatt Regency Palais,Nice,France,en
2018-11-12,10,Awesome. Authentic Monaco experience with perks.,Fairmont Monte Carlo,Monaco,France,en
2018-11-11,8,Lovely hotel and good location. Hotel bar etc expensive.,Hyatt Regency Palais,Nice,France,en
2018-11-11,10,A perfect end to a challenging cruise around the Mediterranean in one of the worst storms of the Century.,Hyatt Regency Palais,Nice,France,en
2018-11-08,8,Bien place. Besoin les chambres de moderniser un peut.,Fairmont Monte Carlo,Monaco,France,fr
2018-11-07,10,Sono stata al Majestic a Pasqua 2018; un vero piacere soggiornare lì. Personale cortese; hotel stupendo; palestra con vista mare e ottima la posizione. Consigliato,barriere-le-majestic,Cannes,France,it
2018-11-06,6,Niet bijzonder de hotel maar de location is goed voor ons,Warwick Geneva,Geneva,Switzerland,nl
2018-11-05,10,Hotel in splendida posizione; camere curate e con vista; staff disponibile e servizio di valet parking perfetto. Lo consiglio vivamente.,barriere-le-majestic,Cannes,France,it
2018-11-04,10,Periodicamente soggiorniamo presso questo albergo che gode di posizione ottima e di servizio di massimo livello. Ottimi cocktails al bar; piscina riscaldata fruibile praticamente tutto l'anno; due buoni ristoranti; colazione cara ma con offerta davvero strepitosa. Niente da dire; una delle migliori strutture che abbiamo incontrato.,barriere-le-majestic,Cannes,France,it
2018-11-04,8,Dans une chambre double; les clients sont fondés à s’attendre à bénéficier de deux sièges; et non d’un seul comme ce fut notre cas (chambre 2016). Ceci dit; un bref séjour très agréable.,Warwick Geneva,Geneva,Switzerland,fr
2018-11-02,8,Bellissimo Hotel posizione eccellente un po’ esosi i prezzi degli extra,barriere-le-majestic,Cannes,France,it
2018-11-02,10,Excellent hotel; très bon emplacement avec vue sur la mer; services impecables.,Hyatt Regency Palais,Nice,France,fr
2018-11-02,8,Great location on the main beach boulevard. Is about a 10 minute walk to the center of town.,Hyatt Regency Palais,Nice,France,en
2018-11-02,8,Had a great time at this hotel staff friendly and helpful and at check in finding out you got a tickets for the transport system for you stay included a real bonus!,Warwick Geneva,Geneva,Switzerland,en
2018-11-01,6,I would not say this is a 5 star hotel. I chose it based on the reviews but clearly different people have different tastes. This is a regular hotel and pretty outdated. If you like upscale hotels this is not it.,Hyatt Regency Palais,Nice,France,en
2018-11-01,8,Hotel of high quality but very expensive to eat and drink there.,Hyatt Regency Palais,Nice,France,en
2018-11-01,10,Hotel muito bom. Bonito e bem organizado. Quartos grandes com varanda e persiana elétrica. Roupa de cama de alta qualidade. Banheiro grande e completo ; com ótimo chuveiro . Piscina aquecida ; coberta e aberta ; em uma área linda de frente pra praia . Não tomei o café da manhã porque achei caro ( €28;00 por pessoa) . Estacionamento pago; mas os manobristas são rápidos.,Hyatt Regency Palais,Nice,France,pt
2018-10-31,10,Je conseille cet hôtel pour sa situation; l'amabilité du personnel à l'accueil; dans les chambres et dans tout l'hôtel. Bon restaurant. Merveilleux séjour on reviendra.,barriere-le-majestic,Cannes,France,fr
2018-10-31,8,If you have hip or knee problems; there is difficulty getting into the high tub for a shower.  There is no accommodation for the disabled.,Warwick Geneva,Geneva,Switzerland,en
2018-10-29,10,Servizio al top; peccato per la camera non insonorizzata si sentivano i rumori dalle altre stanze.,barriere-le-majestic,Cannes,France,it
2018-10-29,10,Hotellin yleistilat ovat ensiluokkaiset ja juuri niin bling-bling kuin voi Monacon kuuluisimmassa kurvissa sijaitsevan hotellin osalta olettaa. Mutta; huoneet kaipaisivat päivitystä ja etenkin hotellin käytävät huoneisiin tuovat mieleen lähinnä väsyneen Ruotsinlaivan. Sijainti on aivan huippu ja palvelu ystävällistä.,Fairmont Monte Carlo,Monaco,France,fi
2018-10-29,6,Just about ok but given it’s a 5 star hotel one should expect much more. Decor is grim and tasteless; room was indistinguishable from a 3 star Novotel; far too much single use of plastic everywhere and the coffee in the room was sachets of Nescafé!?!?!  Also we ate dinner in the restaurant and although the service was passable; the food was appalling,Hyatt Regency Palais,Nice,France,en
2018-10-29,10,Beautiful hotel with friendly staff. Close to the train station making commuting around the city and to/from the airport with public transit very easy. Room was spotless.,Warwick Geneva,Geneva,Switzerland,en
2018-10-28,10,Perfect stay at Le Majestic. Lovely staff; excellent service & we could even enjoy the beach at the end of October!,barriere-le-majestic,Cannes,France,en
2018-10-28,10,Personnel tres accueuillant hotel tres calme literie tres confortable. Nous reviendrons.,Fairmont Monte Carlo,Monaco,France,fr
2018-10-27,10,Hotel magnifique et très bien situé. Le personnel est extraordinaire.,barriere-le-majestic,Cannes,France,fr
2018-10-27,10,Lovely hotel close to beach; restaurants and shops,barriere-le-majestic,Cannes,France,en
2018-10-27,10,Very nice hotel on the beachfront view from rooms of sea is wonderful. Hotel staff are very friendly and helpful and will accommodate wherever they can!,Hyatt Regency Palais,Nice,France,en
2018-10-27,10,酒店的地理位置优越， 就在火车站对面， 进出日内瓦便利。附近餐厅多。酒店的一切设施都好。 值得推荐。,Warwick Geneva,Geneva,Switzerland,zh
2018-10-26,10,Hotel fabuleux personnel de tres haut niveau tre belles prestationq en general,barriere-le-majestic,Cannes,France,fr
2018-10-26,8,Great location next to station and suitable for business trip.,Warwick Geneva,Geneva,Switzerland,en
2018-10-26,10,I liked that the property is centrally located and that the facilities are excellent.,Warwick Geneva,Geneva,Switzerland,en
2018-10-25,10,Hôtel idéalement situé ; proche de la plage et des commerces ; personnel sympathique et chambres très agréables et confortables,Hyatt Regency Palais,Nice,France,fr
2018-10-23,10,Hôtel extraordinaire personnel au top prestations super restaurant super plage fermer,barriere-le-majestic,Cannes,France,fr
2018-10-23,10,The best hotel in Cannes.  The two other famous five star hotels on La Croisette in Cannes are snooty and the staff is not friendly.  At Le Majestic the staff is terrific; friendly and helpful with smiles. That attitude comes from the top.  I have stayed at this hotel during the high season and low seasons; and have never been disappointed. The breakfast buffet is outstanding.,barriere-le-majestic,Cannes,France,en
2018-10-23,10,Excellent hotel; near the beach and the Palais des Festivals.,barriere-le-majestic,Cannes,France,en
2018-10-23,6,ok and not much amazing! not as comfortable as planned.,Warwick Geneva,Geneva,Switzerland,en
2018-10-21,10,Very helpful staff and beautiful area. Nothing was a problem.,barriere-le-majestic,Cannes,France,en
2018-10-21,10,Todo excelente como todos los hoteles de esta cadena; súper buen ubicado; las amenidades de muy buena calidad! Las camas muy cómodas,Fairmont Monte Carlo,Monaco,France,es
2018-10-20,10,hotel di alto standing; personale attento al cliente.,barriere-le-majestic,Cannes,France,it
2018-10-20,10,perfect view and helpful staff - thoroughly enjoyed the massage and spa facilities - dinner was not great - service was slow especially when it came time for the check and the steak I ordered lacked flavor and tenderness - enjoyed having lunch and relaxing on the pool deck - delightful staff,Fairmont Monte Carlo,Monaco,France,en
2018-10-20,8,Hotel is nice. I had a quiet room in the back; so noise was not an issue. Room was clean and while a bit threadbare in places; it was in mainly good condition. I did not find the front desk people at all helpful—hardly friendly for that matter.,Hyatt Regency Palais,Nice,France,en
2018-10-19,8,splendido hotel l'unica nota dolente sono i lavori che stanno effettuando per costruire l'isola artificiale che rovinano la vista mare,Fairmont Monte Carlo,Monaco,France,it
2018-10-19,10,The room and the lobby were very nice.  One warning.... It is a tough place to drive in to.  There is not a drive up spot that is easily accessed.  And one more note.... When they say your room has no view; they mean you will be looking into a number of nearby residents' balconies.  You will want to keep the curtains shut!,Hyatt Regency Palais,Nice,France,en
2018-10-18,10,Very good overall restaurants and  hotel as well as the staff,barriere-le-majestic,Cannes,France,en
2018-10-16,8,Hôtel magnifique. Nous avions la chambre standard qui donne sur des énormes tuyaux; dommage (bien que client GOLD ). Sinon le petit déjeuner est excellent avec des produits de grande qualité et du champagne (étonnant mais agréable de prendre une coupe près de la piscine). Le personnel est parfait. L’emplacement aussi. La décoration très belle.,barriere-le-majestic,Cannes,France,fr
2018-10-16,10,Great location.  Pool and spa facilities are top notch.,Fairmont Monte Carlo,Monaco,France,en
2018-10-16,8,크루즈 같이 구성된 건물과 인테리어인데다 바다가 보이니 안에서 밖을 보면 크루즈여행하는 기분이 나요. 아주 가까운 곳에 스타벅스랑 맥도날드가 있어서 편하고 좋았습니다.,Fairmont Monte Carlo,Monaco,France,ko
2018-10-16,10,Location very convenient; super nice breakfast; professional employees,Fairmont Monte Carlo,Monaco,France,en
2018-10-16,10,The staff were all very friendly.  The hotel is clean and quiet.  Food is expensive at the hotel; but it is close to many cheaper places with excellent cuisine; and some shopping as well if you enjoy that.,Hyatt Regency Palais,Nice,France,en
2018-10-16,10,下次再來日内瓦，會再次入住；酒店處於火車站左側，易於尋找；24小時check in服務，可以更快得到休息的空間；附近有多間食店和超市，樓下就係電車站，超方便的位置,Warwick Geneva,Geneva,Switzerland,zh
2018-10-15,10,Très beau séjour; chambre magnifique et service au top!,barriere-le-majestic,Cannes,France,fr
2018-10-15,10,Mycket nöjda med vår vistelse som helhet. Perfekt läge; bra pool; bra frukost; vänilig personal. Vi åt middag på Nobu en kväll och den var inte lika bra som det brukar men påverkar inte vårt omdöme för hotellet.,Fairmont Monte Carlo,Monaco,France,sv
2018-10-15,10,The staff was the best! Made us feel special.,Hyatt Regency Palais,Nice,France,en
2018-10-14,10,Très belle Hôtel et le personnel est très gentil,barriere-le-majestic,Cannes,France,fr
2018-10-14,10,Beautiful hotel with excellent service.,Hyatt Regency Palais,Nice,France,en
2018-10-14,10,We loved our stay at this property. The concierges are extremely helpful! We will definitely be staying here again.,Hyatt Regency Palais,Nice,France,en
2018-10-13,8,I enjoyed a one night stay at your hotel which was up to all standards; as expected. But the breakfast price of EUR40 and up; made me skip the morning meal. A very positive was the check-in: I was early and yet Isabelle made a great and effective effort in finding me a top notch room - it took some time but was worth every minute spent,barriere-le-majestic,Cannes,France,en
2018-10-12,10,Erinomainen hinta/laatusuhde! Olimme hotellissa kaksi yötä 5 kk vauvamme kanssa; joka sai myös erinomaista palvelua :)! Hotelli itsessään oli upea elämys; hyvällä maulla sisustettu ja huone oli todella iso ja sänky mukava. Palvelu oli aina erinomaista.,barriere-le-majestic,Cannes,France,fi
2018-10-12,8,Very central and next to the train station; the location is excellent. Lovely lobby; bar with hospitable staff. Room was a bit small and bed not terribly comfortable but overall was excellent value of money.,Warwick Geneva,Geneva,Switzerland,en
2018-10-11,10,Great hotel with super helpful staff. The team made our stay in Monaco/Monte Carlo simply great. Minor drawback is the construction; which will be affecting the area for a while; unfortunatelly.,Fairmont Monte Carlo,Monaco,France,en
2018-10-10,10,Very nice service staff. However not provided shampoo and shower gel. The bathroom design can be improved; as shower can splash and excessively wet the floor. Overall very good hotel,barriere-le-majestic,Cannes,France,en
2018-10-09,8,The staff were very welcoming and helpful. The room was very clean and provided absolute comfort.,barriere-le-majestic,Cannes,France,en
2018-10-09,10,Great location.  Modern hotel with fantastic amenities,Warwick Geneva,Geneva,Switzerland,en
2018-10-09,8,The hotel is ideally  situated close to the main station; shops and restaurants but bring plenty of money if you are staying in Geneva,Warwick Geneva,Geneva,Switzerland,en
2018-10-08,8,Great location; friendly staff. Overall a very nice hotel. I would recommend this hotel to anyone as it's a above average hotel.,Hyatt Regency Palais,Nice,France,en
2018-10-08,10,Very delicious breakfast!,Warwick Geneva,Geneva,Switzerland,en
2018-10-07,10,Great hotel staff! They were welcoming and helped us plan a last minute stay. Knowledgeable on the area with great restaurant recommendations. Hotel was clean with nice facilities. Bar staff made great drinks and bell boys were helpful.,Warwick Geneva,Geneva,Switzerland,en
2018-10-06,10,Was upgraded on arrival.  Excellent room and service,barriere-le-majestic,Cannes,France,en
2018-10-06,2,Pésima limpieza de los cuartos.,barriere-le-majestic,Cannes,France,es
2018-10-03,10,great location-great facilities; great view; and Nikki Beach is the place to be.....  My go to hotel when in Monaco.,Fairmont Monte Carlo,Monaco,France,en
2018-10-03,10,Hotel location is excellent!  Due to its architecture; most sea views are partial,Hyatt Regency Palais,Nice,France,en
2018-10-02,8,Excellent location with great facilities; I would definitely stay here again.,Fairmont Monte Carlo,Monaco,France,en
2018-09-30,10,Amazing stay! The staff was amazing and the hotel was beautiful.,barriere-le-majestic,Cannes,France,en
2018-09-30,4,Decepcionada com o hotel. Hotel com quartos antigos; com cara de sujos e velhos. Chegamos no quarto e não tinham recolocado os irens do frigobar. No dia seguinte a mesma coisa. Atendimento fraco. Não é digno de 5 estrelas,Hyatt Regency Palais,Nice,France,pt
2018-09-30,10,Pretty Hôtel centrally locates; very helpful staff,Hyatt Regency Palais,Nice,France,en
2018-09-28,10,perfecte locatie,barriere-le-majestic,Cannes,France,nl
2018-09-27,8,Great location - great staff - worth every penny.  Entrance to the rooms seems sideways and awkward giving the room a smaller feel but after a while you get use to it.,Fairmont Monte Carlo,Monaco,France,en
2018-09-26,10,Great! What a beautiful hotel; and we were treated very kindly by the woman who checked us in.,barriere-le-majestic,Cannes,France,en
2018-09-25,10,Sehr freundlicher Empfang ; stilvolles Hotel ; super Zimmer ; tolle Lage und Upgrade für Familienanlass . Es war eine Freude aber natürlich auch ziemlich teuer . Beste Grüsse Patrick Weynands,barriere-le-majestic,Cannes,France,de
2018-09-25,10,Excellent location; friendly staff; clean beautiful rooms,barriere-le-majestic,Cannes,France,en
2018-09-25,10,Top Service; tolle Umgebung - einfach perfekt,barriere-le-majestic,Cannes,France,de
2018-09-25,10,Beautiful hotel in a great location. We were able to check in early; were given an upgrade to a sea front room and on returning to our room one evening cound we had been left some delicious cake in celebration of our wedding anninversary.,Hyatt Regency Palais,Nice,France,en
2018-09-24,10,Excellent hotel. Meets American standard for better hotel. Beautiful lobby; excellent service; AC works very well; quiet. Local gym privileges and located about a 3 minute walk from the hotel. Wi-fi works well. Will stay again.,Warwick Geneva,Geneva,Switzerland,en
2018-09-22,10,This is THE place to stay at in Cannes for many reasons. Let's start with the fact that it's one of the most beautiful and luxurious hotels you will see. Moreover; it has best location in Cannes. Train station (5 mins) if you want to visit Monaco; port (10 mins) for a trip to St. Tropez; all the fancy shops right at hotel's entrance. There is a private beach with a good restaurant; amazing pool with bar and food and great service.,barriere-le-majestic,Cannes,France,en
2018-09-22,8,Great stay in an amazing location.  Just wish there was more of a heads up on all the coastal drilling; construction going on.  Paid for more for the ocean view upgrade and chose the hotel for that reason. Unpleasantly surprised to have off shore drilling all night and bright lights fr the cranes.  Hotel manger was nice enough to include a complementary breakfast buffet which was nice.  I just didn’t get the experience we had hoped for with an ocean view in Monte Carlo.,Fairmont Monte Carlo,Monaco,France,en
2018-09-22,2,O Hotel é bem localizado. Quartos são bons. Mas para mim pecam forte em pequenos detalhes. Vou citar três situações que vivenciei em apenas uma diária: a) cheguei no hotel as 13 horas e pedi se podia fazer check in. Embora houvesse quarto disponível o atendente falou que somente seria possível após as 15 horas ou eu deveria pagar uma taxa. Ressalto que é uma prática bem comum em hoteis deixar fazer check in antes se o quarto esta disponível. Na mesma viagem parei em outros dois hoteis muito bons (Chateau De La Chevre D Or - Eze e Negresco; Nice) e em ambos os casos foi possível. b) solicitei um quarto silencioso pois estava com  bebe de seis meses com dificuldades para dormir. Acontece que me colocaram em um quarto que fica um andar abaixo do lobby; e havia uma festa naquela noite. O barulho de batidas de salto no teto somente parou as 1 AM. c) fomas para a piscina as 10:30 AM. Quase não haviam hospedes na piscina. Acontece que mesmo assim as únicas poltronas que eu poderia sentar eram bem distantes da piscina e sem sombra (horríveis para quem esta com um bebê). As poltronas envolta da piscina eram pagas. As seguintes ja estavam todas reservadas. Enfim; embora fosse a piscina do hotel os hóspedes só podem a utilizar plenamente pagando taxas; ou solicitando reserva prévia de cadeiras. Completo absurdo. Obviamente não é uma experiência que será repetida.,Fairmont Monte Carlo,Monaco,France,pt
2018-09-22,10,Wonderful stay in a first-class hotel. Very friendly and knowledgeable staff and overall a superb experience.,Hyatt Regency Palais,Nice,France,en
2018-09-21,10,Dette hotellet lever opp til sine 5 stjerner. Tross i at vi første natten fikk et lite hjørnerom; fikk vi dagen etter byttet til et større rom uten noen som helst sure miner. Frokost buffe hadde alt man kan tenke seg; nydelig mat. Kort vei til stranda; og shopping i dyre merkevare butikker; men også de litt billigere. Gangavstand til gamlebyen med masse små hyggelige restauranter.,barriere-le-majestic,Cannes,France,no
2018-09-21,10,Lovely place; kindly stuff; excellent but too expancive breakfast.,barriere-le-majestic,Cannes,France,en
2018-09-21,6,留意房問方向真實訂房細則……,Fairmont Monte Carlo,Monaco,France,zh
2018-09-20,10,Highly recommend for an amazing stay in Cannes! The hotel was an awesome location with easy access to many cute areas to eat; shop and relax. The beach club was amazing -- service was excellent; very clean and very private. The pool was also very nice! Food was excellent at the restaurant + room service! The room was very spacious + had excellent air conditioning. Perfect place to go to experience Cannes the right way.,barriere-le-majestic,Cannes,France,en
2018-09-20,10,Amazing perfect location,Hyatt Regency Palais,Nice,France,en
2018-09-20,10,Attentive staff. Friendly. Very accommodating.,Hyatt Regency Palais,Nice,France,en
2018-09-19,8,Had a fabulous four day; three night stay celebrating friends 60 big birthday - 8 of us friends four couples - breakfast expensive at nearly 60 euros hence we just did it the once but it was very good.  We got a good deal to stay there.,barriere-le-majestic,Cannes,France,en
2018-09-19,10,Great hotel. Only minor gripes were some fluctiations with the shower water temperature where it would get very hot periodically.,Hyatt Regency Palais,Nice,France,en
2018-09-19,8,Close to the main Station. Clean. Friendly efficient staff;,Warwick Geneva,Geneva,Switzerland,en
2018-09-18,8,Deutlich in die Jahre gekommenes 4-Sterne-Haus in allerdings hervorragender Lage direkt am Wasser. Personal sehr freundlich; Frühstück OK; Zimmer renovierungsbedürftig.,Fairmont Monte Carlo,Monaco,France,de
2018-09-18,10,Best hotel in Nice  location is great very friendly staff,Hyatt Regency Palais,Nice,France,en
2018-09-17,10,Great place to stay. Centrally located and very high end.,barriere-le-majestic,Cannes,France,en
2018-09-17,10,Staff is professional and very helpful.  Just wish they had a larger fitness room with more amenities.,Hyatt Regency Palais,Nice,France,en
2018-09-17,10,Attended overnight for a friends wedding.  Faultless stay; fabulous,Hyatt Regency Palais,Nice,France,en
2018-09-16,10,beautiful hotel; excellent and helpful staff; right on promenade and close to old town and activities,Hyatt Regency Palais,Nice,France,en
